<?xml version="1.0" encoding="UTF-8" standalone="yes"?>
<?xml-stylesheet type="text/xsl" href="lexUnit.xsl"?>
<lexUnit status="Created" POS="ADV" name="speedily.adv" ID="14976" frame="Speed" frameID="966" totalAnnotated="0" xsi:schemaLocation="../schema/lexUnit.xsd" xmlns="http://framenet.icsi.berkeley.edu" xmlns:xsi="http://www.w3.org/2001/XMLSchema-instance">
    <header>
        <frame>
            <FE fgColor="FFFFFF" bgColor="1E90FF" type="Core" abbrev="Att" name="Attribute"/>
            <FE fgColor="FFFFFF" bgColor="A52A2A" type="Extra-Thematic" abbrev="Cir" name="Circumstances"/>
            <FE fgColor="FFFFFF" bgColor="FF00FF" type="Core" abbrev="Deg" name="Degree"/>
            <FE fgColor="FFFFFF" bgColor="FF0000" type="Core" abbrev="Ent" name="Entity"/>
            <FE fgColor="FFFFFF" bgColor="00008B" type="Extra-Thematic" abbrev="Exp" name="Explanation"/>
            <FE fgColor="FFFFFF" bgColor="008000" type="Core" abbrev="Spe" name="Speed"/>
            <FE fgColor="FFFFFF" bgColor="FFA500" type="Extra-Thematic" abbrev="Tim" name="Time"/>
        </frame>
    </header>
    <definition>FN: in a rapid manner</definition>
    <lexeme POS="ADV" name="speedily"/>
    <valences/>
</lexUnit>