<?xml version="1.0" encoding="UTF-8" standalone="yes"?>
<?xml-stylesheet type="text/xsl" href="lexUnit.xsl"?>
<lexUnit status="Created" POS="PREP" name="from_to.prep" ID="14414" frame="Delimitation_of_diversity" frameID="1680" totalAnnotated="0" xsi:schemaLocation="../schema/lexUnit.xsd" xmlns="http://framenet.icsi.berkeley.edu" xmlns:xsi="http://www.w3.org/2001/XMLSchema-instance">
    <header>
        <frame>
            <FE fgColor="FFFFFF" bgColor="FF69B4" type="Peripheral" abbrev="deg" name="Degree"/>
            <FE fgColor="FFFFFF" bgColor="FF0000" type="Core" abbrev="Item" name="Item"/>
            <FE fgColor="FFFFFF" bgColor="006400" type="Core" abbrev="Low" name="Limit1"/>
            <FE fgColor="FFFFFF" bgColor="00BFFF" type="Core" abbrev="Upp" name="Limit2"/>
            <FE fgColor="FFFFFF" bgColor="00008B" type="Core" abbrev="Val" name="Limits"/>
            <FE fgColor="FFFFFF" bgColor="9400D3" type="Core" abbrev="Var" name="Variable"/>
        </frame>
    </header>
    <definition>FN: indicating extreme points of a range.</definition>
    <lexeme order="1" headword="true" breakBefore="false" POS="PREP" name="from"/>
    <lexeme order="2" headword="false" breakBefore="true" POS="PREP" name="to"/>
    <valences/>
</lexUnit>