<?xml version="1.0" encoding="UTF-8" standalone="yes"?>
<?xml-stylesheet type="text/xsl" href="lexUnit.xsl"?>
<lexUnit status="Created" POS="A" name="next generation.a" ID="11652" frame="Stage_of_progress" frameID="1341" totalAnnotated="0" xsi:schemaLocation="../schema/lexUnit.xsd" xmlns="http://framenet.icsi.berkeley.edu" xmlns:xsi="http://www.w3.org/2001/XMLSchema-instance">
    <header>
        <frame>
            <FE fgColor="FFFFFF" bgColor="800080" type="Peripheral" abbrev="deg" name="Degree"/>
            <FE fgColor="FFFFFF" bgColor="FF0000" type="Peripheral" abbrev="dom" name="Domain"/>
            <FE fgColor="FFFFFF" bgColor="0000FF" type="Core" abbrev="ent" name="Entity"/>
            <FE fgColor="FFFFFF" bgColor="FF00FF" type="Peripheral" abbrev="man" name="Manner"/>
            <FE fgColor="FFFFFF" bgColor="FFA500" type="Peripheral" abbrev="tim" name="Time"/>
        </frame>
    </header>
    <definition>FN: belonging  to the next stage of advancement</definition>
    <lexeme order="1" headword="false" breakBefore="false" POS="A" name="next"/>
    <lexeme order="2" headword="true" breakBefore="false" POS="N" name="generation"/>
    <valences/>
</lexUnit>