<?xml version="1.0" encoding="UTF-8" standalone="yes"?>
<?xml-stylesheet type="text/xsl" href="lexUnit.xsl"?>
<lexUnit status="Created" POS="V" name="expend.v" ID="15638" frame="Exhaust_resource" frameID="2220" totalAnnotated="0" xsi:schemaLocation="../schema/lexUnit.xsd" xmlns="http://framenet.icsi.berkeley.edu" xmlns:xsi="http://www.w3.org/2001/XMLSchema-instance">
    <header>
        <frame>
            <FE fgColor="FFFFFF" bgColor="FF0000" type="Core" abbrev="age" name="Agent"/>
            <FE fgColor="FFFFFF" bgColor="FF69B4" type="Peripheral" abbrev="man" name="Manner"/>
            <FE fgColor="FFFFFF" bgColor="FF00FF" type="Peripheral" abbrev="mea" name="Means"/>
            <FE fgColor="FFFFFF" bgColor="008000" type="Peripheral" abbrev="pla" name="Place"/>
            <FE fgColor="FFFFFF" bgColor="800080" type="Peripheral" abbrev="pur" name="Purpose"/>
            <FE fgColor="FFFFFF" bgColor="0000FF" type="Core" abbrev="res" name="Resource"/>
            <FE fgColor="FFFFFF" bgColor="FFA500" type="Peripheral" abbrev="tim" name="Time"/>
        </frame>
    </header>
    <definition>FN: use up.</definition>
    <lexeme POS="V" name="expend"/>
    <valences/>
</lexUnit>