<?xml version="1.0" encoding="UTF-8" standalone="yes"?>
<?xml-stylesheet type="text/xsl" href="lexUnit.xsl"?>
<lexUnit status="Created" POS="N" name="fury.n" ID="13651" frame="Emotion_directed" frameID="46" totalAnnotated="0" xsi:schemaLocation="../schema/lexUnit.xsd" xmlns="http://framenet.icsi.berkeley.edu" xmlns:xsi="http://www.w3.org/2001/XMLSchema-instance">
    <header>
        <frame>
            <FE fgColor="FFFFFF" bgColor="00BFFF" type="Extra-Thematic" abbrev="cir" name="Circumstances"/>
            <FE fgColor="FFFFFF" bgColor="FF69B4" type="Peripheral" abbrev="Degr" name="Degree"/>
            <FE fgColor="FFFFFF" bgColor="0000FF" type="Extra-Thematic" abbrev="ET" name="Empathy_target"/>
            <FE fgColor="FFFFFF" bgColor="A52A2A" type="Core" abbrev="Event" name="Event"/>
            <FE fgColor="FFFFFF" bgColor="800080" type="Core" abbrev="Exp" name="Experiencer"/>
            <FE fgColor="FFFFFF" bgColor="008000" type="Core" abbrev="Exr" name="Expressor"/>
            <FE fgColor="000000" bgColor="7FFF00" type="Extra-Thematic" abbrev="" name="Frequency"/>
            <FE fgColor="FFFFFF" bgColor="FF00FF" type="Peripheral" abbrev="" name="Manner"/>
            <FE fgColor="FFFFFF" bgColor="2E8B57" type="Peripheral" abbrev="" name="Parameter"/>
            <FE fgColor="FFFFFF" bgColor="00008B" type="Extra-Thematic" abbrev="Reas" name="Reason"/>
            <FE fgColor="FFFFFF" bgColor="9F79EE" type="Core" abbrev="State" name="State"/>
            <FE fgColor="FFFFFF" bgColor="FF0000" type="Core" abbrev="Stim" name="Stimulus"/>
            <FE fgColor="FFFFFF" bgColor="FFA500" type="Core" abbrev="Top" name="Topic"/>
        </frame>
    </header>
    <definition>COD: extreme anger.</definition>
    <lexeme POS="N" name="fury"/>
    <valences/>
</lexUnit>