<?xml version="1.0" encoding="UTF-8" standalone="yes"?>
<?xml-stylesheet type="text/xsl" href="lexUnit.xsl"?>
<lexUnit status="Created" POS="A" name="situated.a" ID="10025" frame="Being_located" frameID="960" totalAnnotated="0" xsi:schemaLocation="../schema/lexUnit.xsd" xmlns="http://framenet.icsi.berkeley.edu" xmlns:xsi="http://www.w3.org/2001/XMLSchema-instance">
    <header>
        <frame>
            <FE fgColor="000000" bgColor="9F79EE" type="Extra-Thematic" abbrev="" name="Cotheme"/>
            <FE fgColor="FFFFFF" bgColor="800080" type="Extra-Thematic" abbrev="Dep" name="Dependent_state"/>
            <FE fgColor="FFFFFF" bgColor="A9A9A9" type="Core" abbrev="" name="Location"/>
            <FE fgColor="FFFFFF" bgColor="008000" type="Peripheral" abbrev="" name="Place"/>
            <FE fgColor="FFFFFF" bgColor="FF0000" type="Core" abbrev="" name="Theme"/>
            <FE fgColor="FFFFFF" bgColor="FFA500" type="Peripheral" abbrev="" name="Time"/>
        </frame>
    </header>
    <definition>FN: located in a place.</definition>
    <lexeme POS="A" name="situated"/>
    <valences/>
</lexUnit>