<?xml version="1.0" encoding="UTF-8" standalone="yes"?>
<?xml-stylesheet type="text/xsl" href="lexUnit.xsl"?>
<lexUnit status="Created" POS="V" name="disseminate.v" ID="11707" frame="Dispersal" frameID="267" totalAnnotated="0" xsi:schemaLocation="../schema/lexUnit.xsd" xmlns="http://framenet.icsi.berkeley.edu" xmlns:xsi="http://www.w3.org/2001/XMLSchema-instance">
    <header>
        <frame>
            <FE fgColor="FFFFFF" bgColor="FF0000" type="Core" abbrev="Agent" name="Agent"/>
            <FE fgColor="FFFFFF" bgColor="2E8B57" type="Core" abbrev="" name="Cause"/>
            <FE fgColor="FFFFFF" bgColor="808080" type="Peripheral" abbrev="dis" name="Distance"/>
            <FE fgColor="FFFFFF" bgColor="800080" type="Peripheral" abbrev="Goal_a" name="Goal_area"/>
            <FE fgColor="FFFFFF" bgColor="0000FF" type="Core" abbrev="Ind" name="Individuals"/>
            <FE fgColor="FFFFFF" bgColor="FF69B4" type="Peripheral" abbrev="" name="Manner"/>
            <FE fgColor="FFFFFF" bgColor="A52A2A" type="Peripheral" abbrev="" name="Means"/>
            <FE fgColor="FFFFFF" bgColor="00BFFF" type="Peripheral" abbrev="" name="Path"/>
            <FE fgColor="FFFFFF" bgColor="1E90FF" type="Peripheral" abbrev="" name="Place"/>
            <FE fgColor="FFFFFF" bgColor="00008B" type="Extra-Thematic" abbrev="" name="Reason"/>
            <FE fgColor="0000FF" bgColor="d0d0d0" type="Extra-Thematic" abbrev="" name="Result"/>
            <FE fgColor="FFFFFF" bgColor="008000" type="Peripheral" abbrev="Src" name="Source"/>
            <FE fgColor="FFFFFF" bgColor="A9A9A9" type="Peripheral" abbrev="spe" name="Speed"/>
            <FE fgColor="FFFFFF" bgColor="FFA500" type="Peripheral" abbrev="" name="Time"/>
        </frame>
    </header>
    <definition>COD: spread widely</definition>
    <lexeme POS="V" name="disseminate"/>
    <valences/>
</lexUnit>