<?xml version="1.0" encoding="UTF-8" standalone="yes"?>
<?xml-stylesheet type="text/xsl" href="lexUnit.xsl"?>
<lexUnit status="Created" incorporatedFE="Landmark_period" POS="N" name="nowadays.n" ID="14199" frame="Temporal_collocation" frameID="1895" totalAnnotated="0" xsi:schemaLocation="../schema/lexUnit.xsd" xmlns="http://framenet.icsi.berkeley.edu" xmlns:xsi="http://www.w3.org/2001/XMLSchema-instance">
    <header>
        <frame>
            <FE fgColor="FFFFFF" bgColor="800080" type="Extra-Thematic" abbrev="Eve" name="Event_description"/>
            <FE fgColor="FFFFFF" bgColor="90876C" type="Core" abbrev="LEn" name="Landmark_entity"/>
            <FE fgColor="FFFFFF" bgColor="0000FF" type="Core" abbrev="LEv" name="Landmark_event"/>
            <FE fgColor="FFFFFF" bgColor="1E90FF" type="Core" abbrev="LPe" name="Landmark_period"/>
            <FE fgColor="FFFFFF" bgColor="008000" type="Core" abbrev="TEn" name="Trajector_entity"/>
            <FE fgColor="FFFFFF" bgColor="FF00FF" type="Core" abbrev="TEv" name="Trajector_event"/>
            <FE fgColor="FFFFFF" bgColor="FF0000" type="Core" abbrev="TPe" name="Trajector_period"/>
        </frame>
    </header>
    <definition>COD: at the present time, in contrast with the past.</definition>
    <lexeme POS="N" name="nowadays"/>
    <valences/>
    <subCorpus name="other-unmatched-(1)"/>
</lexUnit>