<?xml version="1.0" encoding="UTF-8" standalone="yes"?>
<?xml-stylesheet type="text/xsl" href="lexUnit.xsl"?>
<lexUnit status="Created" POS="V" name="remain.v" ID="14419" frame="Existence" frameID="660" totalAnnotated="0" xsi:schemaLocation="../schema/lexUnit.xsd" xmlns="http://framenet.icsi.berkeley.edu" xmlns:xsi="http://www.w3.org/2001/XMLSchema-instance">
    <header>
        <frame>
            <FE fgColor="FFFFFF" bgColor="A9A9A9" type="Extra-Thematic" abbrev="Cause" name="Cause"/>
            <FE fgColor="FFFFFF" bgColor="00008B" type="Extra-Thematic" abbrev="Circumstances" name="Circumstances"/>
            <FE fgColor="FFFFFF" bgColor="1E90FF" type="Extra-Thematic" abbrev="" name="Concessive"/>
            <FE fgColor="000000" bgColor="EEE8AA" type="Extra-Thematic" abbrev="" name="Depictive"/>
            <FE fgColor="FFFFFF" bgColor="008000" type="Extra-Thematic" abbrev="Dur" name="Duration"/>
            <FE fgColor="FFFFFF" bgColor="0000FF" type="Core" abbrev="Ent" name="Entity"/>
            <FE fgColor="FFFFFF" bgColor="800080" type="Extra-Thematic" abbrev="Use" name="Inherent_purpose"/>
            <FE fgColor="FFFFFF" bgColor="FF0000" type="Peripheral" abbrev="Place" name="Place"/>
            <FE fgColor="FFFFFF" bgColor="9F79EE" type="Extra-Thematic" abbrev="pov" name="Point_of_view"/>
            <FE fgColor="FFFFFF" bgColor="A52A2A" type="Extra-Thematic" abbrev="" name="State"/>
            <FE fgColor="FFFFFF" bgColor="FFA500" type="Peripheral" abbrev="Time" name="Time"/>
        </frame>
    </header>
    <definition>COD: be in the same place or condition during further time.</definition>
    <lexeme POS="V" name="remain"/>
    <valences/>
</lexUnit>