<?xml version="1.0" encoding="UTF-8" standalone="yes"?>
<?xml-stylesheet type="text/xsl" href="lexUnit.xsl"?>
<lexUnit status="Insufficient_Attestations" POS="N" name="v.n" ID="15369" frame="Shapes" frameID="328" totalAnnotated="0" xsi:schemaLocation="../schema/lexUnit.xsd" xmlns="http://framenet.icsi.berkeley.edu" xmlns:xsi="http://www.w3.org/2001/XMLSchema-instance">
    <header>
        <frame>
            <FE fgColor="FFFFFF" bgColor="A52A2A" type="Peripheral" abbrev="" name="Count"/>
            <FE fgColor="FFFFFF" bgColor="FF0000" type="Core" abbrev="" name="Shape"/>
            <FE fgColor="FFFFFF" bgColor="008000" type="Peripheral" abbrev="" name="Shape_prop"/>
            <FE fgColor="FFFFFF" bgColor="0000FF" type="Core" abbrev="" name="Substance"/>
        </frame>
    </header>
    <definition>FN: shaped like the letter 'V'</definition>
    <lexeme POS="N" name="v"/>
    <valences/>
</lexUnit>