<?xml version="1.0" encoding="UTF-8" standalone="yes"?>
<?xml-stylesheet type="text/xsl" href="lexUnit.xsl"?>
<lexUnit status="Created" POS="N" name="high-water mark.n" ID="12491" frame="Extreme_point" frameID="1573" totalAnnotated="0" xsi:schemaLocation="../schema/lexUnit.xsd" xmlns="http://framenet.icsi.berkeley.edu" xmlns:xsi="http://www.w3.org/2001/XMLSchema-instance">
    <header>
        <frame>
            <FE fgColor="FFFFFF" bgColor="FF0000" type="Core" abbrev="ent" name="Entity"/>
            <FE fgColor="FFFFFF" bgColor="008000" type="Core" abbrev="mar" name="Marker"/>
        </frame>
    </header>
    <definition>COD: a maximum recorded level or value.</definition>
    <lexeme order="1" headword="true" breakBefore="false" POS="N" name="high-water"/>
    <lexeme order="2" headword="false" breakBefore="false" POS="N" name="mark"/>
    <valences/>
</lexUnit>