<?xml version="1.0" encoding="UTF-8" standalone="yes"?>
<?xml-stylesheet type="text/xsl" href="lexUnit.xsl"?>
<lexUnit status="Created" POS="V" name="pat down.v" ID="11272" frame="Inspecting" frameID="1262" totalAnnotated="0" xsi:schemaLocation="../schema/lexUnit.xsd" xmlns="http://framenet.icsi.berkeley.edu" xmlns:xsi="http://www.w3.org/2001/XMLSchema-instance">
    <header>
        <frame>
            <FE fgColor="FFFFFF" bgColor="A52A2A" type="Extra-Thematic" abbrev="cir" name="Circumstances"/>
            <FE fgColor="FFFFFF" bgColor="A9A9A9" type="Peripheral" abbrev="deg" name="Degree"/>
            <FE fgColor="FFFFFF" bgColor="00BFFF" type="Core" abbrev="des" name="Desired_state"/>
            <FE fgColor="FFFFFF" bgColor="0000FF" type="Core" abbrev="gro" name="Ground"/>
            <FE fgColor="FFFFFF" bgColor="FF0000" type="Core" abbrev="insp" name="Inspector"/>
            <FE fgColor="FFFFFF" bgColor="9F79EE" type="Peripheral" abbrev="inst" name="Instrument"/>
            <FE fgColor="FFFFFF" bgColor="00008B" type="Extra-Thematic" abbrev="loc" name="Location_of_inspector"/>
            <FE fgColor="FFFFFF" bgColor="FF69B4" type="Peripheral" abbrev="man" name="Manner"/>
            <FE fgColor="FFFFFF" bgColor="9400D3" type="Peripheral" abbrev="mea" name="Means"/>
            <FE fgColor="FFFFFF" bgColor="7CCD73" type="Extra-Thematic" abbrev="" name="Particular_iteration"/>
            <FE fgColor="FFFFFF" bgColor="FFA500" type="Core" abbrev="pur" name="Purpose"/>
            <FE fgColor="00008B" bgColor="d0d0d0" type="Peripheral" abbrev="tim" name="Time"/>
            <FE fgColor="FFFFFF" bgColor="008000" type="Core" abbrev="unw" name="Unwanted_entity"/>
        </frame>
    </header>
    <definition>FN: to tap with the hand over a person's body in search of unwanted things carried </definition>
    <lexeme order="1" headword="true" breakBefore="false" POS="V" name="pat"/>
    <lexeme order="2" headword="false" breakBefore="true" POS="ADV" name="down"/>
    <valences/>
</lexUnit>