<?xml version="1.0" encoding="UTF-8" standalone="yes"?>
<?xml-stylesheet type="text/xsl" href="lexUnit.xsl"?>
<lexUnit status="Created" POS="PREP" name="through the roof.prep" ID="12583" frame="Position_on_a_scale" frameID="95" totalAnnotated="0" xsi:schemaLocation="../schema/lexUnit.xsd" xmlns="http://framenet.icsi.berkeley.edu" xmlns:xsi="http://www.w3.org/2001/XMLSchema-instance">
    <header>
        <frame>
            <FE fgColor="FFFFFF" bgColor="FF69B4" type="Peripheral" abbrev="" name="Degree"/>
            <FE fgColor="FFFFFF" bgColor="008000" type="Peripheral" abbrev="" name="Domain"/>
            <FE fgColor="FFFFFF" bgColor="FF0000" type="Core" abbrev="Item" name="Item"/>
            <FE fgColor="FFFFFF" bgColor="00008B" type="Core-Unexpressed" abbrev="Val" name="Value"/>
            <FE fgColor="FFFFFF" bgColor="9400D3" type="Core" abbrev="Var" name="Variable"/>
        </frame>
    </header>
    <definition>FN: extremely high</definition>
    <lexeme order="1" headword="true" breakBefore="false" POS="PREP" name="through"/>
    <lexeme order="2" headword="false" breakBefore="false" POS="ART" name="the"/>
    <lexeme order="3" headword="false" breakBefore="false" POS="N" name="roof"/>
    <valences/>
</lexUnit>